"id","section","question","answer"
"85","Viewings","What happens if I need to cancel or reschedule my viewing?","We understand that students have busy schedules so please do not worry. All we ask is that you let us know before the viewing so our team is not expecting you and we will get back in contact with you to reschedule the viewing for a more suitable time."
"86","Viewings","How long does it take to confirm my booking after submitting the required documents?","Confirmation of booking is instant, subject to payment clearing. Payments made from a UK bank will be instantly added to your account, however international transfers can take several working days to clear in our bank."
"87","Viewings","Is there a limit to how early I can book a room before the start of the academic year?","Bookings for the upcoming academic year will be live in November every year once the renewal period for current residents is over. Please contact the sales team to arrange a viewing prior to bookings going live so we can ensure that you have priority on our waiting list."
"88","Viewings","What should I check during a property viewing to ensure it meets my needs?","We understand how important it is to feel confident about your accommodation choice before booking. Our friendly sales team will make sure you feel at ease and will take the time to understand your requirements over a coffee when you arrive at the building. To ensure the property meets your needs, we recommend checking both the studio and communal spaces carefully, paying attention to details like cleanliness, space, and functionality.
Additionally, we encourage you to explore the area surrounding the property. Take a walk to nearby amenities such as the university, shops, and transportation options to get a better sense of the daily experience in the city."
"89","Additional Questions","Can I bring someone along for the viewing?","Yes absolutely. You are welcome to bring any friend or family member with you on your viewing. We recommend letting us know prior to the viewing so we can make necessary arrangements."
"90","Additional Questions","What documents do I need to bring for the booking process?","You will be required to upload your identification and proof of studies when making a booking. You will also be required to enter your course details, such as the university you are studying at, the course you are studying and your year of study. If you have any questions regarding the information that is required, please do not hesitate to ask."
"91","Additional Questions","Can I request specific room features or preferences during the booking process?","Yes absolutely, please let us know any specific features or preferences, such as room type, floor level, or adjustments to the studio when booking so we can do our best to help."
